{
  "changes": [
    {
      "change_type": "modified",
      "path": "tools/demo/c_tool.py",
      "reason": "smoke fixture",
      "sha256": "aca8ad990e4269dc661aff10a5bb887469f8d49c7c6bc1bee1fc15269ac34f61"
    },
    {
      "change_type": "modified",
      "path": "tools/demo/c_manifest.json",
      "reason": "smoke fixture",
      "sha256": "6a778aa25bbe7671e998a8455ff8a07fc39ee2f8b0dfc5fa3020315581926178"
    }
  ],
  "owner": "C_worker",
  "run_id": "factory_smoke_20260218_103031_001",
  "schema_version": 1
}
