{
  "changes": [
    {
      "change_type": "modified",
      "path": "apps/demo/src/a_feature.ts",
      "reason": "smoke fixture",
      "sha256": "236f0deacf4b6de54ddb1b62c2c4e45eca2e9cda8d64e7796bbc0a9170f2c0df"
    },
    {
      "change_type": "modified",
      "path": "apps/demo/src/a_service.ts",
      "reason": "smoke fixture",
      "sha256": "91e61ed6f798ef066337e413b4a584889587a6391307aea7fdc3d59634707fbc"
    }
  ],
  "owner": "A_worker",
  "run_id": "factory_smoke_20260218_103533_001",
  "schema_version": 1
}
