{
  "changes": [
    {
      "change_type": "modified",
      "path": "apps/demo/src/b_feature.ts",
      "reason": "smoke fixture",
      "sha256": "6e3294a4f53ba4048f4032af299bc98de06b2f07a15026538c60b60e97a9d786"
    },
    {
      "change_type": "modified",
      "path": "apps/demo/src/b_ui.ts",
      "reason": "smoke fixture",
      "sha256": "87954143182488e3ca8c11e489fa982a2223106da421e0c295fd2e0bb8d2196a"
    }
  ],
  "owner": "B_worker",
  "run_id": "factory_smoke_test_20260218_000000_001",
  "schema_version": 1
}
